{
  "schemaVersion": 1,
  "id": "rolex.gmt-master-ii.126710-family",
  "brand": "Rolex",
  "modelFamily": "GMT-Master II",
  "reference": "126710-family",
  "displayName": "Rolex GMT-Master II 126710 family",
  "dialType": "APPLIED_INDEX",
  "capabilities": [
    "applied-index-geometry",
    "triangle-12-relationship",
    "date-centering",
    "cyclops-alignment",
    "rotating-bezel-alignment",
    "rehaut-alignment",
    "sel-gap"
  ],
  "enabledModules": [
    "gmt.triangle12.relationship"
  ],
  "calibrationIds": {
    "triangle12": "rolex-gmt-126710-triangle12-corrected-pilot-v2"
  }
}
